{
  "schema": 1,
  "revision": 42,
  "written_at": "2026-10-19T18:00:00Z",
  "max_slots": 5,
  "host": {
    "cpu_cores": 32,
    "mem_gib": 96,
    "disk_gib": 2000,
    "io_mbps": 1000,
    "measured_at": "2026-10-19T18:00:00Z"
  },
  "host_reserve_percent": 10,
  "share_mode": "even",
  "profiles": {
    "linux": {
      "count": 4,
      "share_percent": null,
      "backend": "wsl-legacy",
      "active_generation": null
    },
    "windows": {
      "count": 1,
      "share_percent": null,
      "backend": "hyperv-vm",
      "active_generation": "win25-vs2026-x64/20261007.264.1-aap.1"
    }
  },
  "legacy_adopted": true,
  "slot_generations": [
    7,
    7,
    7,
    3,
    2
  ],
  "reservations": [
    {
      "reservation_id": "r-00000000000000a1",
      "slot": 1,
      "profile": "linux",
      "backend": "wsl-legacy",
      "image_generation": "legacy-manager-2",
      "lease_generation": 7,
      "state": "busy",
      "idempotency_key": "r-00000000000000a1/7",
      "acquired_at": "2026-10-19T18:00:00Z",
      "state_changed_at": "2026-10-19T18:00:00Z",
      "heartbeat_at": "2026-10-19T18:00:00Z",
      "cpus": 5,
      "mem_gib": 17,
      "mem_overhead_mib": 0,
      "disk_gib": 0,
      "io_mbps": 0,
      "vm_id": null,
      "runner_name": null,
      "cleanup_uncertain": false,
      "quarantine_kind": null,
      "quarantine_reason": null,
      "teardown_proof": null
    },
    {
      "reservation_id": "r-00000000000000a2",
      "slot": 2,
      "profile": "linux",
      "backend": "wsl-legacy",
      "image_generation": "legacy-manager-2",
      "lease_generation": 7,
      "state": "ready",
      "idempotency_key": "r-00000000000000a2/7",
      "acquired_at": "2026-10-19T18:00:00Z",
      "state_changed_at": "2026-10-19T18:00:00Z",
      "heartbeat_at": "2026-10-19T18:00:00Z",
      "cpus": 5,
      "mem_gib": 17,
      "mem_overhead_mib": 0,
      "disk_gib": 0,
      "io_mbps": 0,
      "vm_id": null,
      "runner_name": null,
      "cleanup_uncertain": false,
      "quarantine_kind": null,
      "quarantine_reason": null,
      "teardown_proof": null
    },
    {
      "reservation_id": "r-00000000000000a3",
      "slot": 3,
      "profile": "linux",
      "backend": "wsl-legacy",
      "image_generation": "legacy-manager-2",
      "lease_generation": 7,
      "state": "ready",
      "idempotency_key": "r-00000000000000a3/7",
      "acquired_at": "2026-10-19T18:00:00Z",
      "state_changed_at": "2026-10-19T18:00:00Z",
      "heartbeat_at": "2026-10-19T18:00:00Z",
      "cpus": 5,
      "mem_gib": 17,
      "mem_overhead_mib": 0,
      "disk_gib": 0,
      "io_mbps": 0,
      "vm_id": null,
      "runner_name": null,
      "cleanup_uncertain": false,
      "quarantine_kind": null,
      "quarantine_reason": null,
      "teardown_proof": null
    },
    {
      "reservation_id": "r-1a2b3c4d000000b1",
      "slot": 4,
      "profile": "windows",
      "backend": "hyperv-vm",
      "image_generation": "win25-vs2026-x64/20261007.264.1-aap.1",
      "lease_generation": 3,
      "state": "busy",
      "idempotency_key": "r-1a2b3c4d000000b1/3",
      "acquired_at": "2026-10-19T18:00:00Z",
      "state_changed_at": "2026-10-19T18:00:00Z",
      "heartbeat_at": "2026-10-19T18:00:00Z",
      "cpus": 5,
      "mem_gib": 16,
      "mem_overhead_mib": 512,
      "disk_gib": 190,
      "io_mbps": 100,
      "vm_id": "6f1d2c3b-4a59-4e6f-8a7b-9c0d1e2f3a4b",
      "runner_name": "aap-w-4-3-1a2b3c4d",
      "cleanup_uncertain": false,
      "quarantine_kind": null,
      "quarantine_reason": null,
      "teardown_proof": null
    },
    {
      "reservation_id": "r-5e6f7a8b000000b2",
      "slot": 5,
      "profile": "windows",
      "backend": "hyperv-vm",
      "image_generation": "win25-vs2026-x64/20261007.264.1-aap.1",
      "lease_generation": 2,
      "state": "draining",
      "idempotency_key": "r-5e6f7a8b000000b2/2",
      "acquired_at": "2026-10-19T18:00:00Z",
      "state_changed_at": "2026-10-19T18:00:00Z",
      "heartbeat_at": "2026-10-19T18:00:00Z",
      "cpus": 5,
      "mem_gib": 16,
      "mem_overhead_mib": 512,
      "disk_gib": 190,
      "io_mbps": 100,
      "vm_id": "0d0e0f10-1112-4314-9516-171819202122",
      "runner_name": "aap-w-5-2-5e6f7a8b",
      "cleanup_uncertain": false,
      "quarantine_kind": null,
      "quarantine_reason": null,
      "teardown_proof": null
    }
  ]
}
